Name,Slug,Created Date,Updated Date,Short Description,Introduction,Why You'll Love This,Tips,Ingredients Overview,Instructions Overview,FAQ,Related Recipes,Author,Prep Time,Cook Time,Total Time,Servings,Calories,Diet,Category,Cuisine,Recipe Card Ingredients,Recipe Card Instructions,Nutrition,Source URL
"Two-Ingredient Chocolate Protein Cosmic Muffins","two-ingredient-chocolate-protein-cosmic-muffins","February 9, 2026","February 9, 2026","These incredibly simple high-protein muffins require just egg whites and protein powder, making them one of my go-to recipes for a quick, healthy dessert or snack with minimal calories.","When I first shared these cosmic muffins, the internet went wild - and for good reason. Sometimes the best recipes are the simplest ones, and these two-ingredient protein muffins prove exactly that. With just whipped egg whites and your favorite protein powder, you can create fluffy, cloud-like muffins that deliver serious protein without the guilt.

What makes these truly special is how light and airy they are. By whipping the egg whites to stiff peaks and gently folding in protein powder, you're essentially creating a protein-packed meringue that bakes into the most satisfying little treats. At only 50 calories per muffin, you can enjoy all five and still come in under 250 calories total. Life is all about balance, which is why I add a few dark chocolate M&Ms halfway through baking - because sometimes you need a little something extra.

I developed this recipe for those moments when you want something sweet but don't want to spend hours in the kitchen or derail your nutrition goals. They're perfect for meal prep, post-workout snacks, or when you want something sweet but don't want to feel guilty about it. These are vegetarian, naturally gluten-free, and take just 15 minutes from start to finish. I've made batch after batch of these, and they never get old. The texture is unlike anything else - not quite a traditional muffin, more like eating a cloud of protein-packed goodness. You can experiment with different protein powder flavors too. I typically use plant-based chocolate, but vanilla, strawberry, or even peanut butter protein powder all work beautifully.","You'll love that they only need 2 base ingredients - egg whites and protein powder,I designed these to be incredibly low calorie at just 50 calories per muffin,The high protein content keeps you satisfied and supports muscle recovery,They're ready in just 15 minutes with minimal cleanup,I made them naturally gluten-free and they can be made with plant-based protein powder,The light, fluffy, cloud-like texture is unlike any other muffin you've tried,They're perfect for meal prep - I make a batch and enjoy throughout the week","Make sure your egg whites are at room temperature for best whipping results - I always take mine out of the fridge 30 minutes before,Whip the egg whites until they form stiff peaks - this is crucial for the fluffy texture,I always fold in the protein powder gently to preserve all those air bubbles you just created,Don't overmix when adding the protein powder - gentle folds are key to maintaining that cloud-like texture,The optional dark chocolate M&Ms are added halfway through baking so they don't sink to the bottom,I store these in an airtight container in the refrigerator for up to 5 days,These taste great cold straight from the fridge or at room temperature - I actually prefer them cold","The magic of this recipe is in its simplicity. Egg whites are pure protein with virtually no fat or carbohydrates, making them ideal for high-protein, low-calorie baking. When whipped to stiff peaks, they create an airy, cloud-like texture that's absolutely heavenly. You'll need 200 grams of egg whites, which you can buy pre-separated in cartons at most grocery stores for convenience. I used to separate eggs myself, but buying the cartons saves so much time and mess.

The protein powder adds both flavor and a serious protein boost while keeping the recipe vegetarian-friendly. I use Momentous plant-based chocolate protein powder because I love the flavor and it mixes beautifully into the egg whites, but any protein powder you love will work - whey, casein, or plant-based all create delicious results. I've tested this with at least a dozen different brands and flavors. Try vanilla, strawberry, or peanut butter flavored protein for variety. Each creates a completely different flavor profile.

The dark chocolate M&Ms are completely optional but highly recommended. They provide a small indulgence and hit of chocolate that makes these feel like a real dessert rather than just a protein snack. If you want to keep them even healthier, swap for sugar-free chocolate chips. I've also done mini chocolate chips, cacao nibs, and even fresh berries pressed into the tops.","The technique for these muffins is straightforward but requires a gentle touch. You'll start by preheating your oven and preparing your muffin tin - I always use liners for easy cleanup, though a good non-stick pan works too.

The key step is whipping those egg whites properly. Add them to a completely clean, grease-free bowl (any oil or fat will prevent them from whipping), then use a hand mixer or stand mixer on high speed. You're looking for stiff peaks that stand straight up when you lift the beaters - this usually takes me about 3-5 minutes. Don't rush this step; properly whipped whites are what give these their signature texture.

Once you have those beautiful peaks, gently fold in your protein powder using a rubber spatula. Use a folding motion from the bottom up and over, being careful not to deflate all that air you just incorporated. The mixture should stay light and fluffy. Divide among your muffin cups and bake for just 5 minutes, then add your chocolate if using, and bake another 5 minutes. The short baking time keeps them moist inside while setting the structure. I've found that overbaking makes them dry and dense, so watch them carefully.","[object Object],[object Object],[object Object],[object Object]","High-Protein Chocolate Mug Pie (Chocolate Mousse),Chocolate Chip Pumpkin Muffins,Chickpea Blondies with Aquafaba Whipped Topping","Holistic Bravo","5 minutes","10 minutes","15 minutes","5 muffins","50 calories per muffin (250 for all 5)","Vegetarian, High-Protein, Gluten-Free","Dessert, Snack","American","200g egg whites (about 3/4 cup from a carton, or from approximately 6-7 large eggs),1 scoop plant-based chocolate protein powder (or any protein powder of choice - approximately 25-30g),Optional: 10-12 dark chocolate M&Ms for topping (or mini chocolate chips)","Preheat oven to 350°F (175°C) and prepare a muffin tin with 5 liners or non-stick spray.,Add 200g of egg whites to a completely clean, grease-free mixing bowl. Using a hand mixer or stand mixer, whip on high speed for 3-5 minutes until stiff peaks form (peaks should stand straight up without drooping).,Gently fold in 1 scoop of chocolate protein powder using a rubber spatula, using a folding motion from bottom to top to preserve the air bubbles. Mix just until incorporated - don't overmix.,Divide the light, fluffy mixture evenly among the 5 muffin cups, filling each about 3/4 full.,Bake at 350°F for 5 minutes, then remove from oven.,If using chocolate M&Ms, gently place 2-3 on top of each muffin now (this prevents them from sinking to the bottom).,Return to oven and bake for another 5 minutes (10 minutes total baking time) until lightly golden and set to the touch.,Let cool in the pan for 5 minutes, then transfer to a wire rack. Enjoy warm or cold - I love them straight from the fridge!","[object Object]","https://www.youtube.com/watch?v=VHTnDIuHmaY"
"High-Protein Vegetarian Breakfast Bowl","high-protein-vegetarian-breakfast-bowl","February 9, 2026","February 9, 2026","A powerhouse breakfast featuring homemade chocolate chip protein bagels and a loaded omelet, delivering 87g of protein to keep you full for 6+ hours - all vegetarian.","Don't skimp out on breakfast - make it your most satiating meal of the day. That's my philosophy behind this incredible high-protein vegetarian breakfast, and it's been a game-changer for me. This meal is designed to be a protein powerhouse that keeps you full for a solid six hours or more, all without a single piece of meat.

The star of this breakfast is the homemade chocolate chip protein bagels made in an air fryer. These aren't your typical bagels - they're packed with Greek yogurt and protein powder, creating a dense, satisfying bread that's loaded with protein. Paired with a hearty three-egg omelet topped with feta cheese and creamy avocado, this breakfast delivers an impressive 87 grams of protein. I developed this recipe because I was tired of being hungry an hour after breakfast.

This is the kind of breakfast I eat when I have a long day ahead and don't want to think about food again for hours. It's perfect for those who train hard, work demanding jobs, or simply want to start their day feeling completely satisfied. After eating this meal, food doesn't even cross my mind for six hours - sometimes longer. The combination of protein, healthy fats, and complex carbs keeps my energy stable and my mind focused.","You'll get an impressive 87g of protein from vegetarian sources only,I designed this to keep you full and satisfied for 6+ hours - it really works,The homemade protein bagels are surprisingly easy to make, even for beginners,You can meal prep the bagels ahead and freeze them for quick breakfasts all week,The air fryer method makes the bagels quick and convenient with minimal cleanup,This is perfect for breaking a fast or as pre-workout fuel,I love how it combines complex carbs, protein, and healthy fats for complete nutrition,No meat required - this is a vegetarian protein powerhouse","I always make the bagels ahead and freeze them for quick breakfasts throughout the week - total time saver,Air fryer cooking times may vary by model - I check mine at 15 minutes to avoid overcooking,Don't skip flipping the bagels halfway through for even cooking and that perfect golden exterior,Room temperature ingredients mix together more easily for the bagel dough,I like to add vegetables to my omelet for extra nutrients and fiber - spinach and tomatoes are my favorites,Cook the omelet on medium-low heat for the creamiest, most tender eggs,If you don't have an air fryer, these bagels bake beautifully in a regular oven at 350°F for about 25 minutes","This recipe is divided into two components: the chocolate chip protein bagels and the loaded omelet. Let me break down what makes each component special.

For the bagels, you'll use a combination of bread flour and Greek yogurt as the base. The Greek yogurt not only provides protein but also creates a chewy, satisfying texture without any yeast or rising time needed - which I love because I'm not patient enough for traditional bagel recipes. One scoop of protein powder boosts the protein content significantly. I use vanilla or unflavored protein powder because it works especially well with the chocolate chips, but any flavor you like will work. The baking soda and salt help the bagels rise and develop flavor. Mini chocolate chips add sweetness and make these feel like a treat rather than just health food. Trust me, these are good enough that you won't feel like you're eating 'diet food.'

The omelet starts with three whole eggs plus 50 grams of egg whites for extra protein without additional fat - this is my trick for bumping up protein without making the omelet too heavy. A chunk of feta cheese adds salty, tangy flavor and even more protein. I'm generous with the feta because it makes the whole dish taste amazing. Half an avocado provides healthy fats that help keep you satiated longer and round out the meal with creamy richness. A sprinkle of sea salt brings all the flavors together.","Making this breakfast involves two parallel processes that come together beautifully. I typically start with the bagels since they take longer, and while they're in the air fryer, I prep and cook the omelet.

For the bagels, you'll mix the dry ingredients with Greek yogurt to form a thick, cohesive dough. It comes together quickly - no kneading required. Fold in the chocolate chips, shape into bagels (I've gotten pretty good at this with practice), and air fry them for 20 minutes total, flipping halfway through. The high heat creates a golden exterior while keeping the inside dense and chewy.

While the bagels are cooking, I whisk together the eggs and egg whites with crumbled feta, then cook the omelet in a non-stick pan until it's just set but still creamy. The key is medium-low heat and patience - no one wants a rubbery omelet. Top with sliced avocado and a sprinkle of sea salt, and you've got a restaurant-quality breakfast at home. The whole process takes about 40 minutes, but most of that is hands-off cooking time.","[object Object],[object Object],[object Object],[object Object]","Two-Ingredient Chocolate Protein Cosmic Muffins,Cozy Chunky Oatmeal with Toppings,High-Protein Chocolate Mug Pie","Holistic Bravo","15 minutes","25 minutes","40 minutes","1 complete breakfast","Approximately 750-850 calories","Vegetarian, High-Protein","Breakfast","American","140g bread flour (about 1 cup plus 2 tablespoons),180g Greek yogurt (about 3/4 cup - I use full-fat for best texture),1 scoop protein powder of choice (approximately 25-30g - vanilla or unflavored works great),1 tsp baking soda,1 tsp salt,2 tbsp mini chocolate chips (or regular chocolate chips chopped),3 whole eggs (large),50g egg whites (about 3 tablespoons from a carton),A generous chunk of feta cheese, crumbled (about 1/4 cup or to taste),Half an avocado, sliced,Sea salt to taste","Preheat air fryer to 350°F (or oven to 350°F if not using air fryer).,In a large bowl, mix together 140g bread flour, 180g Greek yogurt, 1 scoop protein powder, 1 tsp baking soda, and 1 tsp salt until a thick dough forms (this takes about 1-2 minutes of mixing).,Fold in 2 tbsp mini chocolate chips, distributing them evenly throughout the dough.,Divide dough into two portions and shape each into a bagel (roll into a rope and connect the ends, or form a ball and poke a hole through the center).,Place bagels in air fryer basket and cook at 350°F for 10 minutes on one side.,Flip bagels carefully and cook for another 10 minutes (20 minutes total) until golden brown and firm to the touch. Set aside to cool slightly.,While bagels are cooking, whisk together 3 whole eggs and 50g egg whites in a bowl until well combined and slightly frothy.,Crumble feta cheese into the egg mixture (use as much as you like - I'm generous with it).,Heat a non-stick pan over medium-low heat with a small amount of butter or cooking spray. Pour in the egg mixture.,Cook the omelet gently, lifting the edges occasionally to let uncooked egg flow underneath. When mostly set but still slightly wet on top (about 3-4 minutes), fold in half.,Slide omelet onto a plate and top with sliced avocado and a sprinkle of sea salt.,Serve alongside your warm protein bagel - breakfast is ready!","[object Object]","https://www.youtube.com/watch?v=dk1uXsAfQtQ"
"Chocolate Chip Pumpkin Muffins","chocolate-chip-pumpkin-muffins","February 9, 2026","February 9, 2026","Delicious fall-inspired muffins made with pure pumpkin puree, wholesome flours, and chocolate chips - all mixed in one bowl for easy cleanup and maximum cozy vibes.","When fall rolls around, there's something magical about baking with pumpkin. These chocolate chip pumpkin muffins capture all the cozy vibes of autumn in the most delicious, wholesome way possible. What makes them extra special is how incredibly easy they are to make - you only need one large bowl, which means minimal cleanup and maximum enjoyment. I'm all about recipes that don't leave my kitchen looking like a disaster zone.

I made these muffins with a combination of all-purpose flour and oat flour, creating a texture that's both tender and hearty. Pure pumpkin puree adds moisture, fiber, and that classic fall flavor we all crave, while pumpkin pie spice fills your kitchen with the most amazing aroma. The mini chocolate chips scattered throughout make every bite a little celebration. These are one of my most-requested recipes during fall.

I have a great tip for making these even easier: invest in a food scale. You can get one for as little as $10, and it will save you from cleaning up all those measuring cups and tablespoons. Trust me, it makes cooking more enjoyable and your measurements more accurate. These muffins bake at a high temperature of 425°F, which creates a beautiful domed top while keeping the inside perfectly moist - it's a professional bakery trick that I swear by.","This is a one-bowl recipe, which means easy cleanup and less time in the kitchen,I designed these with a perfect balance of whole grain nutrition and indulgent chocolate,They use real pumpkin puree, not pumpkin pie filling - much better flavor and nutrition,The optional egg whites add extra protein without changing the flavor,The high baking temperature creates a beautiful bakery-style dome on top,These are naturally lower in sugar with only 2 tablespoons maple syrup for the entire batch,They're perfect for meal prep - I make a batch on Sunday and enjoy all week,You get the best of fall flavors combined with chocolate chip goodness","I highly recommend investing in a food scale for $10 - it makes measuring easier and reduces cleanup significantly,If you don't have oat flour, simply blend rolled oats in a blender until fine - I do this all the time,Make sure you're using pure pumpkin puree, not pumpkin pie filling (which has added sugar and spices you don't need),The high oven temperature (425°F) is intentional - it creates a nice dome on top and I use this trick for all my muffins,I add chocolate chips 'until it looks right to me' - trust your instincts, you can't really go wrong,Store in an airtight container at room temperature for 3 days or refrigerate for up to a week,These freeze beautifully for up to 3 months - I always have a stash in my freezer for quick breakfasts,Use a non-stick muffin pan if you have one to skip the liners","The beauty of these muffins is in the combination of wholesome ingredients that work together to create something truly special. You'll use both all-purpose flour (150g) and oat flour (70g) to create the perfect texture - the all-purpose flour provides structure while the oat flour adds whole grain nutrition and a subtle nutty flavor. If you don't have oat flour, just pulse rolled oats in a blender until they're finely ground. I do this all the time.

Pure pumpkin puree is the star here, providing moisture, fiber, and that quintessential fall flavor while keeping these muffins naturally sweet. Make sure you're using pure pumpkin puree, not pumpkin pie filling, which has added sugar and spices you don't need. One can of pure pumpkin is exactly what you need - I always have a few cans in my pantry during fall.

The leavening comes from baking soda (just 1g, or about 1/4 teaspoon), while salt and pumpkin pie spice (a full tablespoon!) bring all the warm, cozy flavors of cinnamon, nutmeg, ginger, and cloves. Mini chocolate chips get folded in 'until you know it's enough' - I never measure them, and neither should you. For the wet ingredients, one whole egg provides structure and richness, while a tablespoon of olive oil adds moisture. Just 2 tablespoons of maple syrup sweeten the entire batch - the pumpkin and chocolate chips provide plenty of natural sweetness on their own. Optional egg whites (50g) add extra protein without changing the flavor, but you can substitute with another whole egg if you prefer. A teaspoon of vanilla extract rounds everything out with warm, sweet notes.","The technique for these muffins is refreshingly simple - everything goes into one bowl, which is why I make them so often. You'll start by whisking together all your dry ingredients, then add the wet ingredients directly to the same bowl. No fuss, no multiple bowls to wash.

The key to perfect muffins is not overmixing. Once you add the wet ingredients to the dry, mix just until combined - a few lumps are totally fine and actually preferred. Overmixing develops the gluten in the flour, which can make the muffins tough and dense. I learned this the hard way when I first started baking.

The high baking temperature of 425°F is crucial for those beautiful domed tops. The initial blast of heat causes the batter to rise quickly, creating that classic muffin top shape. After about 20-25 minutes, they should be golden brown with a toothpick coming out clean. The smell of pumpkin and chocolate filling your kitchen is just a bonus.","[object Object],[object Object],[object Object],[object Object]","Gluten-Free Pumpkin Cake Pops,Two-Ingredient Chocolate Protein Cosmic Muffins,Chickpea Blondies with Aquafaba Whipped Topping","Holistic Bravo","10 minutes","20-25 minutes","30-35 minutes","12 muffins","Approximately 140-160 calories per muffin","Vegetarian, Plant-Based","Dessert, Snack, Breakfast","American","150g all-purpose flour (about 1 1/4 cups),70g oat flour (about 3/4 cup - or blend rolled oats until fine),1g baking soda (approximately 1/4 tsp),1 tsp salt,1 tbsp pumpkin pie spice (or make your own with cinnamon, nutmeg, ginger, and cloves),Mini chocolate chips (to taste - I use about 1/2 cup but add until it looks right to you),1 whole egg (large),1 can (15 oz) pure pumpkin puree (NOT pumpkin pie filling),1 tbsp olive oil (or melted coconut oil),2 tbsp pure maple syrup (or honey),50g egg whites (about 3 tablespoons from a carton, or 1 additional whole egg),1 tsp vanilla extract","Preheat oven to 425°F (220°C) - yes, that's hot, but trust me on this. Line a 12-cup muffin tin with paper liners or spray with non-stick spray.,In a large mixing bowl, whisk together 150g all-purpose flour, 70g oat flour, 1g baking soda, 1 tsp salt, and 1 tbsp pumpkin pie spice until well combined.,Add mini chocolate chips to the dry ingredients (I don't measure - just add until it looks right to you, about 1/2 cup). Toss them in the flour mixture to coat them.,Add all wet ingredients directly to the same bowl: 1 whole egg, one can of pumpkin puree, 1 tbsp olive oil, 2 tbsp maple syrup, 50g egg whites, and 1 tsp vanilla extract.,Using a wooden spoon or rubber spatula, mix everything together until just combined (don't overmix - a few lumps are fine and actually better for tender muffins).,Divide batter evenly among the 12 muffin cups, filling each about 2/3 to 3/4 full. I use an ice cream scoop for even portions.,Bake at 425°F for 20-25 minutes, until a toothpick inserted into the center comes out clean or with just a few moist crumbs. The tops should be beautifully domed and golden brown.,Let the muffins cool in the pan for 5 minutes (this helps them set), then transfer to a wire rack to cool completely. Enjoy warm or at room temperature!","[object Object]","https://www.youtube.com/watch?v=LVtL2AQKXik"
